107,Vienna (Schill),3.1,101,1.035,3.1,8,"Lager malt kilned to a slightly darker color than Pilsner malt. Use up to 30% in a pale beer or up to 100% in an Oktoberfest or Vienna lager to achieve a dry, slightly toasty malt flavor.",50,1
108,"Wheat Malt, Red (Rahr)",2.5,102,1.037,2.5,7,"Produced from North American grown wheat. Red wheat is a smaller, harder kernel that some brewers prefer in their wheat beers.",75,1
109,"Wheat Malt, White (Rahr)",3,103,1.037,3,7,A domestic wheat malt; can be used for up to 50% of a grain bill.,75,1
110,"Wheat, Dark (Weyermann)",7.5,104,1.037,7.5,7,"Use up to 50% for dark wheat beers, weizenbocks, or in smaller proportions to add body and head retention to other dark ales. Protein rest recommended.",60,1
111,"Wheat, Pale (Weyermann)",1.5,105,1.037,1.5,7,"Use up to 80% for wheat beers, or in smaller proprtions to add body and head retention to Kolsch, altbier, and other ales. Protein rest recommended.",75,1
112,"Wheat, Torrified (Briess)",1,105,1.036,1,7,"Torrified Wheat has been heat treated to break the cellular structure, allowing more rapid hydration and malt enzymes to more completely attack the starches and protein. Torrified Wheat can be used in place of raw wheat when making Belgian-style White and Wit beers. Advantages over raw wheat include normal conversion time and higher yield. Add to the mash along with the malt. Mash as usual.",0,1
113,"Wheat, Unmalted (Rahr)",1,106,1.036,1,7,"Unmalted Wheat is for use in producing authentic Belgian styles, most notably Wit and Lambics. A protein rest is highly recommended if used in mashing.",0,1
114,Briess - CBW® Pilsen Light DME,2.04,150,1.044,2,1,"Subtle Malty - Base Malt, Carapils® Malt",0,0
115,Briess - CBW® Golden Light DME,3.51,150,1.044,4,1,"Malty - Base Malt, Carapils® Malt",0,0
116,Briess - CBW® Bavarian Wheat DME,2.78,150,1.044,3,1,"Neutral, Malty - Base Malt, Wheat Malt",0,0
117,Briess - CBW® Sparkling Amber DME,7.94,150,1.044,10,1,"Rich Malty, Biscuity - Base Malt, Caramel 60L Malt, Munich Malt",0,0
118,Briess - CBW® Traditional Dark DME,22.71,150,1.044,30,1,"Sweet, Intense Malty - Base Malt, Caramel 60L Malt, Munich Malt, Black Malt",0,0
119,Briess - Maltoferm®  A-6000 Black Malt DME,2584,150,1.019,3500,1,Color Adjustment; Neutral Flavor At Low Usage Levels - Blend Of Dark Roasted Malts,0,0
120,Briess - Organic Maltoferm® 10000 Light Malt DME,3.51,150,1.044,4,1,Malty - Organic Base Malt,0,0
121,Muntons - Plain Extra Light DME,3.14,150,1.046,3.5,1,"Palest color English DME in the Munton's line. Ferments very dry. Use for pale ale, English summer ale, and bitter.",0,0
122,Muntons - Plain Light DME,4.25,150,1.046,5,1,"Light-colored English DME, a bit darker than Extra-Light. Use for pale ale, IPA, and bitter.",0,0
123,Muntons - Plain Wheat DME,3.88,150,1.046,4.5,1,"English DME made with pale malt and wheat. Use for English summer ales, wheat beers, or to add body to low-gravity bitter and mild.",0,0
124,Muntons - Plain Amber DME,8.02,150,1.045,10.1,1,"Amber colored English dry malt extract, ferments dry with a malty flavor. Good for Scottish ales, ESB, milds, and brown ales.",0,0
125,Muntons - Plain Dark DME,23.08,150,1.044,30.5,1,"Deeply colored English malt extract, ferments dry with a malty flavor. Good for porters, stout, and brown ales.",0,0
126,Muntons - Plain Extra Dark DME,23.08,150,1.044,30.5,1,Very dark English malt extract with a full flavor. Good for porters or stout.,0,0
127,"Brown Sugar, Light",20,108,1.044,20,1,Brown sugar is a sucrose sugar product with a distinctive brown color due to the presence of molasses. It is either an unrefined or partially refined soft sugar consisting of sugar crystals with some residual molasses content.  Dark brown sugar contains 6.5% molasses.,0,0
128,"Brown Sugar, Dark",40,107,1.044,40,1,Brown sugar is a sucrose sugar product with a distinctive brown color due to the presence of molasses. It is either an unrefined or partially refined soft sugar consisting of sugar crystals with some residual molasses content. Light brown sugar contains 3.5% molasses.,0,0
129,"Candi Sugar, Blonde (Soft)",5,109,1.038,5,1,"Use this soft candi sugar in all of your Belgian beers to impart a wonderfully soft and well-rounded flavor that you have never had in your beers before! A by-product of the rock candi and candi syrup making processes, soft sugar is made up of tiny crystals of beet sugar that have been removed from the syrup by way of a centrifuge. These crystals have a more intense flavor than the traditional sugar rocks American brewers are used to seeing. This is the same candi sugar used by the famous Rochefort brewery in Belgium. Soft and delicate candi syrup flavor and light color.",0,0
130,"Candi Sugar, Brown (Soft)",40,110,1.032,40,1,"Use this soft candi sugar in all of your Belgian beers to impart a wonderfully soft and well-rounded flavor that you have never had in your beers before! A by-product of the rock candi and candi syrup making processes, soft sugar is made up of tiny crystals of beet sugar that have been removed from the syrup by way of a centrifuge. These crystals have a more intense flavor than the traditional sugar rocks American brewers are used to seeing. This is the same candi sugar used by the famous Rochefort brewery in Belgium. Dark brown Soft Candi Sugar is full of dark candi syrup flavor but has a higher sugar content and is easier for some breweries to handle over a liquid sugar.",0,0
131,"Candi Sugar, Clear (Hard)",0,111,1.046,0,1,"Imported from Belgium, this sugar is refined from sugar beets, and is 100% fermentable. 0°L.",0,0
132,"Candi Sugar, Dark (Hard)",275,112,1.046,100,1,"Imported from Belgium, this sugar is refined from sugar beets, and is 100% fermentable. Rated at 275°L; actual color contribution is lower.",0,0
133,"Candi Syrup, Clear",0,114,1.032,0,1,"A premium clear Belgian candi syrup made from beet sugar. Provides clean honey-like flavor to light Belgian Ales. Great for Tripels, Golden Strong ales, or anytime you're looking for increased drinkability and complexity",0,0
134,"Candi Syrup, Amber",45,113,1.032,45,1,"This premium amber Belgian candi syrup is perfect for amber and brown Belgian ales. The syrup is made from beet sugar and has flavors of toffee, vanilla, and toasted bread.",0,0
135,"Candi Syrup, Dark",90,116,1.032,80,1,"D-90 is a versatile dark candi syrup made with pure beet sugar. This syrup creates an unmistakable and subtle chocolate back-palate, toffee, and toasted bread flavors.",0,0
136,"Candi Syrup, D2",180,115,1.032,180,1,"This premium extra dark Belgian candi syrup is made from beet sugar and date sugar and has deep flavors of fresh ground coffee, dark fruit, and toasted bread. Perfect for use in dark Belgian ales. 180 SRM",0,0
137,Cane Sugar,0,117,1.046,0,1,Sucrose,0,0
138,Corn Sugar,0,118,1.042,0,1,Dextrose,0,0
139,"Honey, Basswood",2,120,1.04,2,1,Basswood is an ornamental shade tree that produces cream-colored flowers known for their nectar. Basswood honey has a fresh taste similar to green ripening fruit and a distinctive lingering flavor. ,0,0
140,"Honey, Buckwheat",8,121,1.04,8,1,Buckwheat honey is pungent in flavor with molasses and malty tones and a lingering aftertaste. Buckwheat honey is also very dark in color.,0,0
141,"Honey, Clover",1,122,1.04,1,1,Clover honey is light in color with a floral flavor and a pleasant mild taste.,0,0
142,"Honey, Dandelion",2,123,1.04,2,1,Dandelion honey is rare and original becuuse it is harvested in late spring/early summer and is made from the nectar of dandelion flowers. It is yellow in color like the flower and is very sweet.,0,0
143,"Honey, Orange Blossom",2,119,1.04,2,1,"Orange blossom honey is mild, with citrus-orange notes.",0,0
144,"Honey, White Sage",3,124,1.04,3,1,"Delicate and light with a predominant sweet, clover-like flavor and an elegant floral aftertaste.",0,0
145,"Honey, Wildflower",4,125,1.04,4,1,Light amber in color and is very sweet and robust. This wildflower is produced by placing hives in prairies and grasslands where bees have access to a wide variety of wild plants. The honey is naturally blended by the bees as they visit many different nectar sources.,0,0
146,Lactose,0,126,1.035,0,1,"Lactose is a non-fermentable sugar used to sweeten Brown ales and Stouts. It gives a beer a creamy texture, or \milky\ flavor as it is called in some countries. ",0,0
147,Lyle's Golden Syrup,0,127,1.036,0,1,,0,0
148,Maltodextrine,0,128,1.04,0,1,"Maltodextrine is used largely in low gravity beers, and is a non-fermentable sugar added to the boil (up to 8 ounces in a 5 gallon batch) to add body and mouth-feel to the beer. Maltodextrine does not produce any flavors, and does not add alcohol to your beer.",0,0
149,Maple Syrup,35,129,1.031,35,1,"Maple syrup is a syrup usually made from the xylem sap of sugar maple, red maple, or black maple trees, although it can also be made from other maple species such as the bigleaf maple.",0,0
150,"Molasses, Black Strap",80,130,1.04,80,1,"Molasses is a viscous by-product of the processing of sugar cane, grapes or sugar beets into sugar.",0,0
151,"Molasses, Full Flavor",80,131,1.04,80,1,"Molasses is a viscous by-product of the processing of sugar cane, grapes or sugar beets into sugar.",0,0
152,"Molasses, Mild Flavor",80,132,1.04,80,1,"Molasses is a viscous by-product of the processing of sugar cane, grapes or sugar beets into sugar.",0,0
153,Rice Syrup Solids,0,133,1.04,0,1,"Rice Syrup Solids are used to add alcohol and lighten the body of beers. You add them to the boil at the same time as your malt extract. This is the ingredient used in many American lagers, such as the \King\ of beers. ",0,0
154,Treacle,100,134,1.035,100,1,Treacle is any syrup made during the refining of sugar and is defined as \ uncrystallized syrup produced in refining sugar\.,0,0
155,Turbinado,10,149,1.044,10,1,Turbinado sugar is a raw sugar that is obtained or crystallized from the initial pressing of sugar cane.,0,0
156,Mott's Original Apple Juice,2,148,1.051,2,1,"100% juice. 100% yum. Mott’s juices offer refreshing taste in a convenient assortment of sizes. Enjoy the family size bottle at home or pack some of our 6.75 fl oz boxes or 8 fl oz bottles for kiddies on the go. Whatever flavor you choose, your family gets at least half a cup of fruit in every drink. So go ahead and try them all.",0,0
157,Mott's Original Natural Apple Juice,4,150,1.046,4,1,"100% juice. 100% yum. Mott’s juices offer refreshing taste in a convenient assortment of sizes. Enjoy the family size bottle at home or pack some of our 6.75 fl oz boxes or 8 fl oz bottles for kiddies on the go. Whatever flavor you choose, your family gets at least half a cup of fruit in every drink. So go ahead and try them all.",0,0
